{
  "schemaVersion": "1.0.0",
  "mapId": "sample-customer-substitution",
  "saltId": "local-managed-salt",
  "replacements": [
    {
      "path": "customer.displayName",
      "entityType": "customer",
      "originalDigest": "0000000000000000000000000000000000000000000000000000000000000000",
      "syntheticValue": "Contoso",
      "scope": "deck",
      "approved": true,
      "notes": "Example digest only; never publish a reversible map."
    }
  ]
}
